{
  "name": "Sample Compliance Analysis",
  "description": "Template runbook demonstrating personal data analysis across filesystem and database sources",
  "connectors": [
    {
      "name": "sample_filesystem",
      "type": "filesystem_connector",
      "properties": {
        "root_path": "/path/to/your/files",
        "include_patterns": [
          "*.txt",
          "*.csv",
          "*.log"
        ],
        "exclude_patterns": [
          "*.tmp",
          "node_modules/*"
        ]
      }
    },
    {
      "name": "sample_database",
      "type": "mysql_connector",
      "properties": {
        "host": "${MYSQL_HOST}",
        "port": "${MYSQL_PORT}",
        "user": "${MYSQL_USER}",
        "password": "${MYSQL_PASSWORD}",
        "database": "${MYSQL_DATABASE}",
        "tables": [
          "users",
          "customer_data",
          "transaction_logs"
        ]
      }
    }
  ],
  "analysers": [
    {
      "name": "personal_data_detector",
      "type": "personal_data_analyser",
      "properties": {
        "patterns": [
          "email",
          "phone",
          "ssn",
          "credit_card"
        ],
        "validation_strategy": "llm",
        "confidence_threshold": 0.8
      }
    },
    {
      "name": "processing_purpose_detector",
      "type": "processing_purpose_analyser",
      "properties": {
        "patterns": [
          "marketing",
          "analytics",
          "authentication",
          "payment_processing"
        ]
      }
    }
  ],
  "execution": [
    {
      "name": "Filesystem Personal Data Analysis",
      "description": "Scan files for personal data patterns using LLM validation",
      "connector": "sample_filesystem",
      "analyser": "personal_data_detector",
      "input_schema": "standard_input",
      "output_schema": "personal_data_finding"
    },
    {
      "name": "Database Personal Data Analysis",
      "description": "Examine database tables for personal information and PII patterns",
      "connector": "sample_database",
      "analyser": "personal_data_detector",
      "input_schema": "standard_input",
      "output_schema": "personal_data_finding"
    },
    {
      "name": "Database Processing Purpose Analysis",
      "description": "Identify data processing purposes for GDPR compliance assessment",
      "connector": "sample_database",
      "analyser": "processing_purpose_detector",
      "input_schema": "standard_input",
      "output_schema": "processing_purpose_finding"
    }
  ]
}
